{
  "eixos": [
    {
      "id": "co-eixo-pensamento-computacional",
      "documento": "computacao-2022",
      "nome": "Pensamento Computacional"
    },
    {
      "id": "co-eixo-mundo-digital",
      "documento": "computacao-2022",
      "nome": "Mundo Digital"
    },
    {
      "id": "co-eixo-cultura-digital",
      "documento": "computacao-2022",
      "nome": "Cultura Digital"
    }
  ],
  "objetos_conhecimento": [
    {
      "id": "co-obj-algoritmos",
      "documento": "computacao-2022",
      "nome": "Algoritmos",
      "pai": null
    },
    {
      "id": "co-obj-algoritmos-classicos",
      "documento": "computacao-2022",
      "nome": "Algoritmos clássicos",
      "pai": "co-obj-programacao"
    },
    {
      "id": "co-obj-algoritmos-com-repeticoes-condicionais-simples",
      "documento": "computacao-2022",
      "nome": "Algoritmos com repetições condicionais simples",
      "pai": null
    },
    {
      "id": "co-obj-algoritmos-com-repeticoes-simples",
      "documento": "computacao-2022",
      "nome": "Algoritmos com repetições simples",
      "pai": null
    },
    {
      "id": "co-obj-algoritmos-com-repeticoes-simples-e-aninhadas",
      "documento": "computacao-2022",
      "nome": "Algoritmos com repetições simples e aninhadas",
      "pai": null
    },
    {
      "id": "co-obj-algoritmos-com-selecao-condicional",
      "documento": "computacao-2022",
      "nome": "Algoritmos com seleção condicional",
      "pai": null
    },
    {
      "id": "co-obj-analise-de-programas",
      "documento": "computacao-2022",
      "nome": "Análise de programas",
      "pai": "co-obj-programacao"
    },
    {
      "id": "co-obj-armazenamento-de-dados",
      "documento": "computacao-2022",
      "nome": "Armazenamento de dados",
      "pai": null
    },
    {
      "id": "co-obj-armazenamento-e-transmissao-de-dados",
      "documento": "computacao-2022",
      "nome": "Armazenamento e Transmissão de dados",
      "pai": null
    },
    {
      "id": "co-obj-arquitetura-de-computadores",
      "documento": "computacao-2022",
      "nome": "Arquitetura de computadores",
      "pai": null
    },
    {
      "id": "co-obj-automatos-e-linguagens-baseadas-em-eventos",
      "documento": "computacao-2022",
      "nome": "Autômatos e linguagens baseadas em eventos",
      "pai": "co-obj-programacao"
    },
    {
      "id": "co-obj-autoria-em-meio-digital",
      "documento": "computacao-2022",
      "nome": "Autoria em meio digital",
      "pai": "co-obj-seguranca-e-responsabilidade-no-uso-da-tecnologia"
    },
    {
      "id": "co-obj-codificacao-da-informacao",
      "documento": "computacao-2022",
      "nome": "Codificação da informação",
      "pai": null
    },
    {
      "id": "co-obj-conceituacao-de-algoritmos",
      "documento": "computacao-2022",
      "nome": "Conceituação de Algoritmos",
      "pai": null
    },
    {
      "id": "co-obj-cyberbullying",
      "documento": "computacao-2022",
      "nome": "Cyberbullying",
      "pai": "co-obj-seguranca-e-responsabilidade-no-uso-da-tecnologia"
    },
    {
      "id": "co-obj-decomposicao",
      "documento": "computacao-2022",
      "nome": "Decomposição",
      "pai": "co-obj-estrategias-de-solucao-de-problemas"
    },
    {
      "id": "co-obj-estrategias-de-solucao-de-problemas",
      "documento": "computacao-2022",
      "nome": "Estratégias de solução de problemas",
      "pai": null
    },
    {
      "id": "co-obj-funcionamento-de-dispositivos-computacionais",
      "documento": "computacao-2022",
      "nome": "Funcionamento de dispositivos computacionais",
      "pai": null
    },
    {
      "id": "co-obj-fundamentos-de-seguranca-cibernetica",
      "documento": "computacao-2022",
      "nome": "Fundamentos de Segurança Cibernética",
      "pai": "co-obj-armazenamento-e-transmissao-de-dados"
    },
    {
      "id": "co-obj-fundamentos-de-sistemas-distribuidos",
      "documento": "computacao-2022",
      "nome": "Fundamentos de sistemas distribuídos",
      "pai": "co-obj-sistemas-distribuidos-e-internet"
    },
    {
      "id": "co-obj-fundamentos-de-transmissao-de-dados",
      "documento": "computacao-2022",
      "nome": "Fundamentos de transmissão de dados",
      "pai": "co-obj-armazenamento-e-transmissao-de-dados"
    },
    {
      "id": "co-obj-generalizacao",
      "documento": "computacao-2022",
      "nome": "Generalização",
      "pai": "co-obj-estrategias-de-solucao-de-problemas"
    },
    {
      "id": "co-obj-gestao-de-dados",
      "documento": "computacao-2022",
      "nome": "Gestão de dados",
      "pai": "co-obj-armazenamento-e-transmissao-de-dados"
    },
    {
      "id": "co-obj-hardware-e-software",
      "documento": "computacao-2022",
      "nome": "Hardware e software",
      "pai": null
    },
    {
      "id": "co-obj-impactos-da-tecnologia-digital",
      "documento": "computacao-2022",
      "nome": "Impactos da tecnologia digital",
      "pai": "co-obj-uso-de-tecnologias-computacionais"
    },
    {
      "id": "co-obj-instrucao-de-maquina",
      "documento": "computacao-2022",
      "nome": "Instrução de máquina",
      "pai": null
    },
    {
      "id": "co-obj-interface-fisica",
      "documento": "computacao-2022",
      "nome": "Interface física",
      "pai": null
    },
    {
      "id": "co-obj-internet",
      "documento": "computacao-2022",
      "nome": "Internet",
      "pai": "co-obj-sistemas-distribuidos-e-internet"
    },
    {
      "id": "co-obj-linguagem-de-programacao",
      "documento": "computacao-2022",
      "nome": "Linguagem de Programação",
      "pai": "co-obj-programacao"
    },
    {
      "id": "co-obj-listas-e-grafos",
      "documento": "computacao-2022",
      "nome": "Listas e grafos",
      "pai": null
    },
    {
      "id": "co-obj-logica-computacional",
      "documento": "computacao-2022",
      "nome": "Lógica computacional",
      "pai": null
    },
    {
      "id": "co-obj-matrizes-e-registros",
      "documento": "computacao-2022",
      "nome": "Matrizes e registros",
      "pai": null
    },
    {
      "id": "co-obj-modelagem-de-objetos",
      "documento": "computacao-2022",
      "nome": "Modelagem de objetos",
      "pai": null
    },
    {
      "id": "co-obj-organizacao-de-objetos",
      "documento": "computacao-2022",
      "nome": "Organização de objetos",
      "pai": null
    },
    {
      "id": "co-obj-organizacao-e-representacao-da-informacao",
      "documento": "computacao-2022",
      "nome": "Organização e representação da informação",
      "pai": null
    },
    {
      "id": "co-obj-producao-digital",
      "documento": "computacao-2022",
      "nome": "Produção Digital",
      "pai": "co-obj-uso-de-tecnologias-computacionais"
    },
    {
      "id": "co-obj-programacao",
      "documento": "computacao-2022",
      "nome": "Programação",
      "pai": null
    },
    {
      "id": "co-obj-programacao-com-listas-e-recursao",
      "documento": "computacao-2022",
      "nome": "Programação com listas e recursão",
      "pai": "co-obj-programacao"
    },
    {
      "id": "co-obj-programacao-usando-grafos-e-arvores",
      "documento": "computacao-2022",
      "nome": "Programação usando grafos e árvores",
      "pai": "co-obj-programacao"
    },
    {
      "id": "co-obj-programacao-usando-registros-e-matrizes",
      "documento": "computacao-2022",
      "nome": "Programação usando registros e matrizes",
      "pai": "co-obj-programacao"
    },
    {
      "id": "co-obj-projetos-com-programacao",
      "documento": "computacao-2022",
      "nome": "Projetos com programação",
      "pai": "co-obj-programacao"
    },
    {
      "id": "co-obj-propriedades-de-grafos",
      "documento": "computacao-2022",
      "nome": "Propriedades de grafos",
      "pai": "co-obj-programacao"
    },
    {
      "id": "co-obj-protocolos-de-comunicacao-em-redes",
      "documento": "computacao-2022",
      "nome": "Protocolos de comunicação em redes",
      "pai": "co-obj-armazenamento-e-transmissao-de-dados"
    },
    {
      "id": "co-obj-qualidade-da-informacao",
      "documento": "computacao-2022",
      "nome": "Qualidade da informação",
      "pai": "co-obj-uso-de-tecnologias-computacionais"
    },
    {
      "id": "co-obj-redes-sociais-e-seguranca-da-informacao",
      "documento": "computacao-2022",
      "nome": "Redes sociais e segurança da informação",
      "pai": "co-obj-seguranca-e-responsabilidade-no-uso-da-tecnologia"
    },
    {
      "id": "co-obj-reuso",
      "documento": "computacao-2022",
      "nome": "Reúso",
      "pai": "co-obj-estrategias-de-solucao-de-problemas"
    },
    {
      "id": "co-obj-seguranca-cibernetica",
      "documento": "computacao-2022",
      "nome": "Segurança cibernética",
      "pai": "co-obj-sistemas-distribuidos-e-internet"
    },
    {
      "id": "co-obj-seguranca-cibernetica-cont",
      "documento": "computacao-2022",
      "nome": "Segurança cibernética (cont.)",
      "pai": "co-obj-sistemas-distribuidos-e-internet-cont"
    },
    {
      "id": "co-obj-seguranca-e-responsabilidade-no-uso-da-tecnologia",
      "documento": "computacao-2022",
      "nome": "Segurança e responsabilidade no uso da tecnologia",
      "pai": null
    },
    {
      "id": "co-obj-seguranca-e-responsabilidade-no-uso-da-tecnologia-computacional",
      "documento": "computacao-2022",
      "nome": "Segurança e responsabilidade no uso da tecnologia computacional",
      "pai": null
    },
    {
      "id": "co-obj-seguranca-e-responsabilidade-no-uso-de-tecnologia-computacional",
      "documento": "computacao-2022",
      "nome": "Segurança e responsabilidade no uso de tecnologia computacional",
      "pai": null
    },
    {
      "id": "co-obj-seguranca-em-ambientes-virtuais",
      "documento": "computacao-2022",
      "nome": "Segurança em ambientes virtuais",
      "pai": "co-obj-seguranca-e-responsabilidade-no-uso-da-tecnologia"
    },
    {
      "id": "co-obj-sistema-operacional",